{
  "alternateNames": [],
  "ats": {
    "identifier": "localstack",
    "provider": "WORKABLE"
  },
  "company_type": "Product",
  "description": "LocalStack provides a fully functional local AWS cloud stack, allowing developers to test cloud applications offline.",
  "employees_count": null,
  "hq_country": "DE",
  "id": "localstack",
  "industries": [],
  "is_agency": false,
  "is_social_enterprise": false,
  "logoUrl": "https://media.licdn.com/dms/image/v2/D4D0BAQFafwPOH_O19w/company-logo_100_100/company-logo_100_100/0/1709124073280/localstack_cloud_logo?e=1774483200&v=beta&t=FI-nhC0j-0CR8XEzCxthlANJIMzr7BtAGTaK2GGM2HA",
  "name": "LocalStack",
  "office_locations": [
    "Berlin"
  ],
  "operating_countries": [],
  "remote_policy": "Unknown",
  "updated_at": "2026-03-16T20:45:41.220547Z",
  "verification_level": "verified",
  "visa_sponsorship": null,
  "website": "https://localstack.cloud"
}
