{
  "alternateNames": [],
  "ats": {
    "identifier": "opus-talent-solutions-1",
    "provider": "WORKABLE"
  },
  "company_type": "Agency",
  "description": "Opus Recruitment Solutions is a multi-award-winning global technology recruitment firm.",
  "employees_count": null,
  "hq_country": "UK",
  "id": "opus-recruitment-solutions",
  "industries": [],
  "is_agency": true,
  "is_social_enterprise": false,
  "logoUrl": "https://media.licdn.com/dms/image/v2/D4E0BAQGOdHzm8-upKw/company-logo_100_100/B4EZfGnn0nHcAY-/0/1751383965541/opus_recruitment_solutions_logo?e=1774483200&v=beta&t=x-BfHekM27GTwB7wdU8AsvhMDLnDXb73MQOry5noGrE",
  "name": "Opus Recruitment Solutions",
  "office_locations": [],
  "operating_countries": [],
  "remote_policy": "Unknown",
  "updated_at": "2026-03-16T20:52:50.139842Z",
  "verification_level": "verified",
  "visa_sponsorship": null,
  "website": "https://www.opusrs.com"
}
