{
  "alternateNames": [],
  "ats": {
    "identifier": "spotify",
    "provider": "LEVER"
  },
  "company_type": "Enterprise",
  "description": "Spotify is a world-leading audio streaming service, providing millions of tracks and podcasts to users globally.",
  "employees_count": null,
  "hq_country": "SE",
  "id": "spotify",
  "industries": [],
  "is_agency": false,
  "is_social_enterprise": false,
  "logoUrl": "https://media.licdn.com/dms/image/v2/C560BAQFkDzx_7dqq3A/company-logo_100_100/company-logo_100_100/0/1631377935713?e=1774483200&v=beta&t=Iq-RDRuEE1NAFz-F0g1pL9NWwVkaMVNgIuCAyp_d89Y",
  "name": "Spotify",
  "office_locations": [],
  "operating_countries": [],
  "remote_policy": "Unknown",
  "updated_at": "2026-03-16T20:52:50.092733Z",
  "verification_level": "verified",
  "visa_sponsorship": null,
  "website": "https://www.spotify.com"
}
