{
  "alternateNames": [],
  "company_type": "Consultancy",
  "description": "T-mapp is a global technology partner specializing in high-performance Java backend solutions for international electric markets and financial trading systems.",
  "employees_count": 100,
  "hq_country": "US",
  "id": "t-mapp",
  "industries": [
    "IT Services",
    "Energy Tech",
    "Fintech",
    "Consulting"
  ],
  "is_agency": false,
  "is_social_enterprise": false,
  "logoUrl": "https://media.licdn.com/dms/image/v2/C4D0BAQEMwELtwv385g/company-logo_100_100/company-logo_100_100/0/1644851804966/t_mapp_logo?e=1774483200&v=beta&t=lWp-Pok8hcIC4NRTY-9F0SXpHVNoP74ulojgxR73vuQ",
  "name": "T-mapp",
  "office_locations": [
    "Boston"
  ],
  "operating_countries": [
    "US",
    "BR",
    "MX",
    "Worldwide"
  ],
  "remote_policy": "Remote",
  "updated_at": "2026-03-10T12:00:00Z",
  "verification_level": "silver",
  "visa_sponsorship": {
    "last_verified": null,
    "notes": null,
    "offered": true,
    "source": null,
    "types": []
  },
  "website": "https://www.t-mapp.com"
}
