{
  "alternateNames": [],
  "ats": {
    "identifier": "propellerhead",
    "provider": "LEVER"
  },
  "company_type": "Consultancy",
  "description": "Propellerhead is a New Zealand-based technology partner crafting complex software solutions for major organizations, driven by principles of design excellence and user sovereignty.",
  "employees_count": 100,
  "hq_country": "NZ",
  "id": "propellerhead",
  "industries": [
    "Software Development",
    "Consulting",
    "Enterprise Solutions"
  ],
  "is_agency": false,
  "is_social_enterprise": false,
  "logoUrl": "https://media.licdn.com/dms/image/v2/D560BAQEogzvnlqhX_A/company-logo_100_100/B56ZatabyfGoAQ-/0/1746666110500/propellerhead_logo?e=1773878400&v=beta&t=hDySJkXonzxAV6oTJLn6UPM9z5x1QZVJnHSuxGoYaRo",
  "name": "Propellerhead",
  "office_locations": [
    "Auckland"
  ],
  "operating_countries": [
    "NZ"
  ],
  "remote_policy": "Hybrid",
  "updated_at": "2026-03-10T10:00:00Z",
  "verification_level": "silver",
  "visa_sponsorship": {
    "last_verified": null,
    "notes": null,
    "offered": true,
    "source": null,
    "types": []
  },
  "website": "https://www.propellerhead.co.nz"
}
