{
  "alternateNames": [
    "Envato Elements"
  ],
  "ats": {
    "identifier": "envato-2",
    "provider": "LEVER"
  },
  "company_type": "Product",
  "description": "Envato is a leading creative subscription platform providing unlimited access to millions of digital assets and AI-powered tools for creatives worldwide.",
  "employees_count": 600,
  "hq_country": "AU",
  "id": "envato",
  "industries": [
    "Creative Tech",
    "SaaS",
    "Digital Assets"
  ],
  "is_agency": false,
  "is_social_enterprise": false,
  "logoUrl": "https://media.licdn.com/dms/image/v2/D560BAQHgXnJjidIUng/company-logo_100_100/company-logo_100_100/0/1722482202892/envato_logo?e=1773878400&v=beta&t=nFyRuWdN460qxmPQ6JmKxg0IBf43oY3ZXN_4z_N3LHc",
  "name": "Envato",
  "office_locations": [
    "Melbourne"
  ],
  "operating_countries": [
    "AU",
    "Worldwide"
  ],
  "remote_policy": "Flexible",
  "updated_at": "2026-03-10T09:10:00Z",
  "verification_level": "silver",
  "visa_sponsorship": {
    "last_verified": null,
    "notes": null,
    "offered": true,
    "source": null,
    "types": []
  },
  "website": "https://elements.envato.com"
}
